{
  "metadata": {
    "case_id": "case_sample_001",
    "crime_type": "kidnapping",
    "difficulty": null,
    "actor_count": 7,
    "location_count": 4,
    "generation_seed": 42,
    "version": "0.1.0"
  },

  "chain": [
    {
      "chain_index": 0,
      "event_id": "evt_001",
      "event_type": "CrimeStalking",
      "blanks": [
        {
          "blank_index": 0,
          "event_field": "participants",
          "entity_type": "person",
          "entity_field": "build",
          "correct_value": "person_002",
          "evidence_ids": ["evi_001", "evi_008"]
        },
        {
          "blank_index": 1,
          "event_field": "location",
          "entity_type": "location",
          "entity_field": "name",
          "correct_value": "loc_001",
          "evidence_ids": ["evi_001", "evi_003"]
        }
      ]
    },
    {
      "chain_index": 1,
      "event_id": "evt_002",
      "event_type": "CrimeStage",
      "blanks": [
        {
          "blank_index": 0,
          "event_field": "objects",
          "entity_type": "object",
          "entity_field": "type",
          "correct_value": "obj_001",
          "evidence_ids": ["evi_004", "evi_005"]
        }
      ]
    },
    {
      "chain_index": 2,
      "event_id": "evt_003",
      "event_type": "ActorEnters",
      "blanks": [
        {
          "blank_index": 0,
          "event_field": "participants",
          "entity_type": "person",
          "entity_field": "name",
          "correct_value": "person_002",
          "evidence_ids": ["evi_006", "evi_007", "evi_014"]
        },
        {
          "blank_index": 1,
          "event_field": "location",
          "entity_type": "location",
          "entity_field": "address",
          "correct_value": "loc_001",
          "evidence_ids": ["evi_003", "evi_009"]
        }
      ]
    },
    {
      "chain_index": 3,
      "event_id": "evt_004",
      "event_type": "CrimeCommitted",
      "blanks": [
        {
          "blank_index": 0,
          "event_field": "participants",
          "entity_type": "person",
          "entity_field": "name",
          "correct_value": "person_002",
          "evidence_ids": ["evi_005", "evi_007", "evi_010"]
        },
        {
          "blank_index": 1,
          "event_field": "participants",
          "entity_type": "person",
          "entity_field": "name",
          "correct_value": "person_001",
          "evidence_ids": ["evi_003", "evi_009"]
        },
        {
          "blank_index": 2,
          "event_field": "objects",
          "entity_type": "object",
          "entity_field": "name",
          "correct_value": "obj_006",
          "evidence_ids": ["evi_005", "evi_011"]
        }
      ]
    },
    {
      "chain_index": 4,
      "event_id": "evt_005",
      "event_type": "ActorEnters",
      "blanks": [
        {
          "blank_index": 0,
          "event_field": "location",
          "entity_type": "location",
          "entity_field": "type",
          "correct_value": "loc_003",
          "evidence_ids": ["evi_010", "evi_012"]
        }
      ]
    },
    {
      "chain_index": 5,
      "event_id": "evt_006",
      "event_type": "ObjectMoved",
      "blanks": [
        {
          "blank_index": 0,
          "event_field": "objects",
          "entity_type": "object",
          "entity_field": "type",
          "correct_value": "obj_002",
          "evidence_ids": ["evi_013", "evi_014"]
        },
        {
          "blank_index": 1,
          "event_field": "location",
          "entity_type": "location",
          "entity_field": "name",
          "correct_value": "loc_001",
          "evidence_ids": ["evi_013", "evi_014"]
        }
      ]
    }
  ],

  "matrix": {
    "people": [
      {
        "id": "person_001",
        "name": "Elena",
        "alias": null,
        "age": 34,
        "height": "average",
        "build": "slim",
        "hair_color": "black",
        "home_location": "loc_001",
        "work_location": null,
        "occupation": "Business owner",
        "phone_number": "555-0101",
        "email_address": "elena@email.com",
        "role": "victim",
        "relationships": [
          {"person_id": "person_003", "type": "ex_partner"},
          {"person_id": "person_004", "type": "employer"}
        ],
        "org_affiliation": "Vance Industries",
        "alibi": null,
        "motive": null,
        "opportunity": null
      },
      {
        "id": "person_002",
        "name": "Marcus",
        "alias": "Marc",
        "age": 41,
        "height": "tall",
        "build": "athletic",
        "hair_color": "brown",
        "home_location": "loc_002",
        "work_location": null,
        "occupation": "Unemployed",
        "phone_number": "555-0102",
        "email_address": null,
        "role": "suspect",
        "relationships": [
          {"person_id": "person_005", "type": "debtor"}
        ],
        "org_affiliation": null,
        "alibi": "evt_010",
        "motive": "evt_007",
        "opportunity": "Had access to victim's schedule through social media"
      },
      {
        "id": "person_003",
        "name": "David",
        "alias": null,
        "age": 36,
        "height": "average",
        "build": "average",
        "hair_color": "blonde",
        "home_location": null,
        "work_location": null,
        "occupation": "Accountant",
        "phone_number": "555-0103",
        "email_address": "david@email.com",
        "role": "suspect",
        "relationships": [
          {"person_id": "person_001", "type": "ex_partner"}
        ],
        "org_affiliation": null,
        "alibi": "evt_011",
        "motive": "evt_008",
        "opportunity": "Knew victim's routines"
      },
      {
        "id": "person_004",
        "name": "Sophie",
        "alias": null,
        "age": 28,
        "height": "short",
        "build": "petite",
        "hair_color": "red",
        "home_location": null,
        "work_location": null,
        "occupation": "Personal assistant",
        "phone_number": "555-0104",
        "email_address": "sophie@email.com",
        "role": "witness",
        "relationships": [
          {"person_id": "person_001", "type": "employee"}
        ],
        "org_affiliation": "Vance Industries",
        "alibi": null,
        "motive": null,
        "opportunity": null
      },
      {
        "id": "person_005",
        "name": "Victor",
        "alias": "Vic",
        "age": 52,
        "height": "average",
        "build": "heavy",
        "hair_color": "gray",
        "home_location": null,
        "work_location": "loc_004",
        "occupation": "Casino manager",
        "phone_number": "555-0105",
        "email_address": null,
        "role": "person_of_interest",
        "relationships": [
          {"person_id": "person_002", "type": "creditor"}
        ],
        "org_affiliation": "Golden Chip Casino",
        "alibi": null,
        "motive": null,
        "opportunity": null
      },
      {
        "id": "person_006",
        "name": "Nina",
        "alias": null,
        "age": 67,
        "height": "short",
        "build": "frail",
        "hair_color": "white",
        "home_location": "loc_001",
        "work_location": null,
        "occupation": "Retired",
        "phone_number": "555-0106",
        "email_address": null,
        "role": "witness",
        "relationships": [],
        "org_affiliation": null,
        "alibi": null,
        "motive": null,
        "opportunity": null
      },
      {
        "id": "person_007",
        "name": "Tom",
        "alias": null,
        "age": 45,
        "height": "tall",
        "build": "stocky",
        "hair_color": "black",
        "home_location": null,
        "work_location": "loc_003",
        "occupation": "Security guard",
        "phone_number": "555-0107",
        "email_address": null,
        "role": "witness",
        "relationships": [],
        "org_affiliation": null,
        "alibi": null,
        "motive": null,
        "opportunity": null
      }
    ],

    "locations": [
      {
        "id": "loc_001",
        "name": "Riverside Apartments",
        "address": "142 River Street, Unit 4B",
        "type": "residence",
        "owner": null,
        "residents": ["person_001", "person_006"],
        "access_control": "keypad",
        "operation_hours": "24_7"
      },
      {
        "id": "loc_002",
        "name": "Marcus's Studio",
        "address": "78 Oak Avenue, Unit 12",
        "type": "residence",
        "owner": null,
        "residents": ["person_002"],
        "access_control": "standard_lock",
        "operation_hours": "24_7"
      },
      {
        "id": "loc_003",
        "name": "Dockside Warehouse",
        "address": "Harbor District, Building 7",
        "type": "business",
        "owner": null,
        "residents": [],
        "access_control": "gated",
        "operation_hours": "abandoned"
      },
      {
        "id": "loc_004",
        "name": "Golden Chip Casino",
        "address": "500 Fortune Boulevard",
        "type": "business",
        "owner": "person_005",
        "residents": [],
        "access_control": "security_staff",
        "operation_hours": "24_7"
      }
    ],

    "objects": [
      {
        "id": "obj_001",
        "name": "Roll of Duct Tape",
        "type": "tool",
        "serial_number": null,
        "size": "small",
        "color": "silver",
        "material": "fabric",
        "condition": "worn",
        "owner": "person_002",
        "location": "loc_003"
      },
      {
        "id": "obj_002",
        "name": "Ransom Note",
        "type": "document",
        "serial_number": null,
        "size": "small",
        "color": "white",
        "material": "paper",
        "condition": "damaged",
        "owner": null,
        "location": "loc_001"
      },
      {
        "id": "obj_003",
        "name": "Elena's Phone",
        "type": "personal_item",